uid,species,gene_names,description,term_ids,gene_display_name,color
1942,ath,At5g04040|SDP1|AT5G04040|SUGAR-DEPENDENT1|F8F6.250|F8F6_250,"Seedling lethal without exogenous sucrose. The mutant is severely impaired in its ability to breakdown storage lipid. It has a much slower rate of postgerminative growth which can be rescued by providing sucrose to the mutant. In germinating seedlings, triacylglycerol content in the mutant only declined 20% of that in the wild type and clusters of oil bodies are seen in the mutant at this stage of development.",GO:0012511|GO:0019433|GO:0004806|PO:0000013|PO:0000037|PO:0000230|PO:0008019|PO:0009005|PO:0009006|PO:0009009|PO:0009010|PO:0009025|PO:0009029|PO:0009030|PO:0009031|PO:0009032|PO:0009046|PO:0009047|PO:0009052|PO:0020030|PO:0020038|PO:0020100|PO:0020137|PO:0025022|PO:0025281|PO:0000084|PO:0025195|PO:0000293|PO:0001054|PO:0001078|PO:0001081|PO:0001185|PO:0004507|PO:0007064|PO:0007095|PO:0007098|PO:0007103|PO:0007115|PO:0007123|PO:0007611|PO:0007616|PO:0007632|PO:0001016|PO:0001017,At5g04040,#DAF7A6
4252,ath,AT1G62440|LRX2|leucine-rich repeat/extensin 2|F24O1.19,"No visible phenotype, plants do not show any defect in root hair morphogenesis; lrx2 enhances the lrx1 root hair phenotype.",GO:0000904|GO:0009505|PO:0000256|PO:0000262|PO:0009005,AT1G62440,#DAF7A6
1979,ath,At2g42160|BRIZ1|AT2G42160|BRAP2 RING ZnF UBP domain-containing protein 1|T24P15.7|T24P15_7,"Delayed germination. Pale embryos. Seedling lethal. growth arrest (embryos are slow to emerge from the seed coat; after emergence, the embryos remain white with unexpanded cotyledons even after twelve days on GM media).",GO:0010029|GO:0000151|GO:0004842|GO:0046982|PO:0000013|PO:0000037|PO:0000230|PO:0008019|PO:0009005|PO:0009006|PO:0009009|PO:0009010|PO:0009025|PO:0009029|PO:0009030|PO:0009031|PO:0009032|PO:0009046|PO:0009047|PO:0009052|PO:0020030|PO:0020038|PO:0020100|PO:0020137|PO:0025022|PO:0025281|PO:0000293|PO:0001054|PO:0001078|PO:0001081|PO:0001185|PO:0004507|PO:0007064|PO:0007095|PO:0007098|PO:0007103|PO:0007115|PO:0007123|PO:0007611|PO:0007616,At2g42160,#DAF7A6
828,ath,At4g32720|AtLA1,Embryo defective-Globular.,,At4g32720,#DAF7A6
1110,ath,At1g10840|eIF3h,Abnormal cotyledon morphology. Abnormal cotyledon number. Abnormal silique morphology. Few root hairs. High penetrance of rosette lethality. Increased branching. Low penetrance of pin-formed inflorescences. Short primary root. Warped leaves.,,At1g10840,#DAF7A6
353,ath,At5g66750|DDM1|AT5G66750|CHR1|CHR01|CHA1|SOM4|SOM1|ATDDM1|DECREASED DNA METHYLATION 1|CHROMATIN REMODELING 1|SOMNIFEROUS 1|MSN2.14|MSN2_14,"Decreased DNA methylation. Release of endogenous transposons. DNA hypomethylation and poor growth. Phenotype not described. Sensitive to gamma-irradiation and UV. Typical mutant phenotype of demethylation. Restoration of hygromycin resistance through release from gene silencing. The luminescence response of the ros1/ ros1::ddm1/ddm1 double mutant was much higher than that of ros1/ros1::DDM1/DDM1 plants, but was still lower than that of ROS1/ROS1::DDM1/DDM1 plants.",GO:0051574|GO:0032197|GO:0006346|GO:0090241|GO:0044030|GO:0006349|GO:0016887|GO:0004003|GO:0000786|GO:0009294|GO:0006344|GO:0005515|PO:0000013|PO:0000037|PO:0008019|PO:0009005|PO:0009006|PO:0009009|PO:0009010|PO:0009025|PO:0009029|PO:0009030|PO:0009031|PO:0009032|PO:0009046|PO:0009052|PO:0020038|PO:0020100|PO:0020137|PO:0025022|PO:0025281|PO:0000084|PO:0025195|PO:0000293|PO:0001054|PO:0001078|PO:0001081|PO:0001185|PO:0004507|PO:0007064|PO:0007095|PO:0007098|PO:0007103|PO:0007115|PO:0007611|PO:0007616|PO:0001016|PO:0001017,At5g66750,#DAF7A6
649,ath,At1g15220|AtCCMH,Embryo defective-Cotyledon.,,At1g15220,#DAF7A6
1834,ath,At3g06370|NAX4,Resistant to salt stress.,,At3g06370,#DAF7A6
316,ath,At1g78900|VHA-A|AT1G78900|vacuolar ATP synthase subunit A|F9K20.5|F9K20_5|AT1G78900.1|AT1G78900.2,Complete male gametophyte defective. Female gametophyte defective.,GO:0009941|GO:0000325|GO:0005773|GO:0009651|GO:0005774|GO:0007030|GO:0005886|GO:0009506|GO:0016020|GO:0009507|GO:0005618|GO:0002020|GO:0009555|GO:0005794|GO:0048046|PO:0000013|PO:0000037|PO:0000230|PO:0008019|PO:0009005|PO:0009006|PO:0009009|PO:0009010|PO:0009025|PO:0009029|PO:0009030|PO:0009031|PO:0009032|PO:0009046|PO:0009047|PO:0009052|PO:0020030|PO:0020038|PO:0020100|PO:0020137|PO:0025022|PO:0025281|PO:0009001|PO:0005020|PO:0000005|PO:0005052|PO:0000084|PO:0025195|PO:0000293|PO:0001054|PO:0001078|PO:0001081|PO:0001185|PO:0004507|PO:0007064|PO:0007095|PO:0007098|PO:0007103|PO:0007115|PO:0007123|PO:0007611|PO:0007616|PO:0007131|PO:0001016|PO:0001017|PO:0001170,At1g78900,#DAF7A6
595,ath,At5g39050|PMaT1,Elevated naphthol levels.,,At5g39050,#DAF7A6
1865,ath,At4g34460|AGB1|AT4G34460|ELK4|ATAGB1|GTP binding protein beta 1|ERECTA-LIKE 4|T4L20.40|T4L20_40|ARABIDOPSIS G-PROTEIN BETA SUBUNIT,"Blunt siliques. Rounded leaves. Short petioles. Short siliques. Slightly shorter inflorescence stems. affects leaf, flower and fruit development; rounded leaves and short petiols (rounder than in er mutants, petiols are approx 50% as long as those in the wt, whereas the lamina is approx 125% wider and approx 85% as long as that in the wt, these traits give the rosette a more compact and rounded appearance than that of wt plants); pedicel length is slightly longer than in wt; modest shortening of floral bud length (floral buds at the inflorescence apex appear more tightly clustered together than they are in the wt, but not as clusterd as in er;  decreased silique length and increased silique width (almost identical to that of er phenotype); silique tips have a blunt appearance like in er (valves do not taper apically and contact the style at its midpoint, styles do not extend as far past the valves as they do in the wt); stem length is slightly decreased relative to wt, but it is not as short as in er; expressed in all tissues but is highest in the silique. show more damage than wild-type Col-0 after exposure to either 500 or 700 ppb ozone. Similar to the agb1-2 single mutant in resistance to tunicamycin. gpa1-4, agb1-2 double mutant; kanamycin resistant or silenced. Less sensitive to growth inhibition by tunicamycin than wt. Increased primary root length and lateral root density compared to wild-type. agb1-2 allele is possibly additive to the ndl1-2 allele. GUS expression at the base of the root-shoot junction in emerging cotyledons and vasculature of mature roots. Weak GUS expression in lateral root primordia and elongated roots. Increased lateral root formation. Increased root elongation rate, cortical root cell length and cell production rate in the primary root than the wildtype. ABA-inhibition of stomatal opening reduced.",GO:0005886|GO:0010154|GO:0050832|GO:0005515|GO:0009817|GO:0005834|GO:0030968|GO:0009845|GO:0009887|GO:0009788|GO:0005737|GO:0009991|GO:0072593|GO:0048527|GO:0009723|GO:0009867|GO:0048364|GO:0005783|GO:0080008|PO:0000013|PO:0000037|PO:0000230|PO:0008019|PO:0009005|PO:0009006|PO:0009009|PO:0009010|PO:0009025|PO:0009029|PO:0009030|PO:0009031|PO:0009032|PO:0009046|PO:0009047|PO:0009052|PO:0020030|PO:0020038|PO:0020100|PO:0020137|PO:0025022|PO:0025281|PO:0000014|PO:0000293|PO:0005660|PO:0009015|PO:0001054|PO:0001078|PO:0001081|PO:0001185|PO:0004507|PO:0007064|PO:0007095|PO:0007098|PO:0007103|PO:0007115|PO:0007123|PO:0007611|PO:0007616|PO:0001017,At4g34460,#DAF7A6
5733,ath,AT5G57630|CIPK21|SnRK3.4|CBL-interacting protein kinase 21|SNF1-RELATED PROTEIN KINASE 3.4|MUA2.22|MUA2_22,Inhibition of both root growth and emergence of cotyledons in the cipk21 mutant under salt and mannitol stress. Hypersensitive to salt and osmotic stress.,PO:0000013|PO:0000037|PO:0000230|PO:0008019|PO:0009005|PO:0009006|PO:0009009|PO:0009010|PO:0009025|PO:0009029|PO:0009030|PO:0009031|PO:0009032|PO:0009046|PO:0009047|PO:0020030|PO:0020038|PO:0020100|PO:0020137|PO:0025022|PO:0025281|PO:0000293|PO:0001054|PO:0001078|PO:0001185|PO:0007064|PO:0007095|PO:0007098|PO:0007103|PO:0007115|PO:0007123|PO:0007611|PO:0007616|PO:0001016|PO:0001017,AT5G57630,#DAF7A6
5238,ath,AT4G23940|FtsHi1|ARC1|ACCUMULATION AND REPLICATION OF CHLOROPLASTS 1|FTSH inactive protease 1|T32A16.110|T32A16_110|AT4G23940.1,"density (per unit area) of chloroplasts in mesophyll cells is 50 percent greater than for wild type and chloroplast size is reduced; cotyledons and early leaves are pale but become greener with development and by flowering are only slightly more pale than wild type. pale twisted leaves; mean chloroplast number per cell = 9 (cf. wild type 120); mean chloroplast size = 530m2 (cf. wild type 50m2). Defective in chloroplast accumulation and division. Reduced number of chloroplasts and affected division plane in chloroplast biogenesis. Highly enlongated and multiple arrayed chloroplasts in developing green tissues.  Mutant proteins do not form homodimers, as wt proteins do, and localize aberrantly inside chloroplasts. pale leaves; mean chloroplast number per cell = 79 (cf. wild type 120); mean chloroplast size = 50um2 (cf. wild type 50um2).",GO:0009658|GO:0009941|GO:0010020|GO:0009507|GO:0009536|PO:0000013|PO:0000037|PO:0008019|PO:0009005|PO:0009006|PO:0009009|PO:0009010|PO:0009025|PO:0009029|PO:0009030|PO:0009031|PO:0009032|PO:0009046|PO:0009047|PO:0009052|PO:0020030|PO:0020038|PO:0020100|PO:0020137|PO:0025022|PO:0005052|PO:0000293|PO:0001054|PO:0001078|PO:0001081|PO:0001185|PO:0004507|PO:0007064|PO:0007095|PO:0007098|PO:0007103|PO:0007115|PO:0007123|PO:0007611|PO:0007616,AT4G23940,#DAF7A6
4068,ath,AT1G21700|AT2G33610|SWI3C|ATSWI3C|CHB4|SWITCH/sucrose nonfermenting 3C|F8K7.13|F8K7_13|CHROMATIN REMODELING COMPLEX SUBUNIT B|SWI3B|ATSWI3B|CHB2|switch subunit 3|F4P9.38|F4P9_38,"Delayed development,semi-dwarf growth habit, and formation of aberrant rosettes.  The rosette and cauline leaves are severely twisted along the proximodistal axis, leading to a downward curvature of the lateral edges toward the abaxial leaf surface. Cross sections of leaves showed an increased protrusion of mesophyll cell files around the vascular bundles.  The root system is greatly reduced, because elongation of primary roots is inhibited. Seedlings develop several side roots and secondary root branches. .",GO:0005515|GO:0005634|PO:0000013|PO:0000037|PO:0000230|PO:0008019|PO:0009005|PO:0009006|PO:0009009|PO:0009010|PO:0009025|PO:0009029|PO:0009030|PO:0009031|PO:0009032|PO:0009046|PO:0009047|PO:0009052|PO:0020030|PO:0020038|PO:0020100|PO:0020137|PO:0025022|PO:0025281|PO:0025195|PO:0000293|PO:0001054|PO:0001078|PO:0001081|PO:0001185|PO:0004507|PO:0007064|PO:0007095|PO:0007098|PO:0007103|PO:0007115|PO:0007123|PO:0007611|PO:0007616|PO:0001016|PO:0001017,AT1G21700,#DAF7A6
2516,ath,At3g07970|QRT2|AT3G07970|QUARTET 2|F17A17.31,"Tetrad pollen. Reduced seed set. Indehiscent anthers. outer walls of the four meiotic products of a pollen mother cell are fused and the pollen grains fail to separate, forming pollen tetrads; pollen viable and fertile, and fertilization with a single tetrad usually yields four seeds.",GO:0004650|GO:0010047|GO:0045490|GO:0009901|GO:0048235|PO:0009005|PO:0009029|PO:0009031|PO:0009032|PO:0009046|PO:0009047|PO:0020100|PO:0025022|PO:0000146|PO:0007611|PO:0007616,At3g07970,#DAF7A6
5639,ath,AT5G44925,"The mutant shows ABA insensitivity in stomatal movement, including promotion of stomatal closure and inhibition of stomatal opening. The detached leaves of the mutant lose more water than those of the wild-type plants under dehydration condition; both young seedlings and mature plants of the mutant have lower capacity to conserve water during drought stress in comparison with wild-type plants. The ROS levels increase in the mutant in comparison with wild-type plants in both the whole leaves and in guard cells. Treatment with low concentrations of ABA reduces ROS levels in both whole leaves(1 to 10 uM ABA application) and in guard cells(5 uM ABA application) in the mutant plants.",,AT5G44925,#DAF7A6
4540,ath,AT2G30290|VSR2|VSR1;2|BP80-1;2|AtVSR2|VACUOLAR SORTING RECEPTOR 2|VACUOLAR SORTING RECEPTOR 1;2|binding protein of 80 kDa 1;2|T9D9.10|T9D9_10,No visible phenotype.,GO:0017119|PO:0009032|PO:0009046|PO:0025022|PO:0025281|PO:0025195|PO:0007611|PO:0007616|PO:0001016|PO:0001017,AT2G30290,#DAF7A6
5613,ath,AT5G40820|ATR|ATRAD3|ATATR|Ataxia telangiectasia-mutated and RAD3-related|ARABIDOPSIS THALIANA ATAXIA TELANGIECTASIA-MUTATED AND RAD3-RELATED|MHK7.5|MHK7_5,"atr/tert mutants show a more rapid loss of telomeric length than tert and atm/tert mutants, and show a more rapid degeneration in growth habit, becoming small, with aberrant leaf shape, and very low fertility by the third generation whereas tert mutants and tert/atm mutants show normal growth features until later generations. These mutants also have marked defects in chromosomal organization by G3 as evidenced by the presence of anaphase bridges, sometimes involving multiple chromosomes, a phenotype not seen in tert or atm/tert mutants. Double mutants are defective in telomere maintainance. Mutants form anaphase bridges.",GO:0010044|GO:0006281|GO:0010332|GO:0007004|GO:0033044|GO:0007126|GO:0032204|GO:0009506|GO:0032504|PO:0000282|PO:0000037|PO:0009005|PO:0009009|PO:0009010|PO:0009031|PO:0009046|PO:0020100|PO:0025022|PO:0000084|PO:0001078|PO:0001081|PO:0001185|PO:0004507|PO:0007611|PO:0007616,AT5G40820,#DAF7A6
5938,ath,EMB1063,embryo defective; terminal embryo phenotype: globular stage.,GO:0005575|GO:0008150|GO:0003674,EMB1063,#DAF7A6
2347,ath,At3g33520|AtARP6,Curled leaves. Early flowering independent of photoperiod. Increased petal number. Increased sepal number. Reduced fertility. Serrated leaf margins. Short inflorescence stems. Slightly longer hypocotyl. Small flowers. Small leaves.,,At3g33520,#DAF7A6
7243,ath,EMB51,"developmental arrest of mutant embryos occurs at heart, torpedo stage; pale yellow-green seeds; pale yellow-green embryo; 26% mutant; 51.4% aborted seeds in top half of silique.",GO:0003674|GO:0009793|GO:0005575,EMB51,#DAF7A6
5453,ath,AT5G11030|ALF4|ABERRANT LATERAL ROOT FORMATION 4|T5K6.20|T5K6_20,reduced fertility mutant: male sterile. suppressor of superoot2-1 phenotype.,GO:0005634|GO:0005829|GO:0010102|GO:0005737|PO:0000013|PO:0000037|PO:0000230|PO:0008019|PO:0009005|PO:0009006|PO:0009009|PO:0009010|PO:0009025|PO:0009029|PO:0009030|PO:0009031|PO:0009032|PO:0009046|PO:0009047|PO:0009052|PO:0020030|PO:0020100|PO:0020137|PO:0025022|PO:0020094|PO:0000293|PO:0001054|PO:0001078|PO:0001081|PO:0001185|PO:0004507|PO:0007064|PO:0007095|PO:0007098|PO:0007103|PO:0007115|PO:0007123|PO:0007611|PO:0007616,AT5G11030,#DAF7A6
4193,ath,AT1G53310|AT1G17710|PPC1|ATPPC1|PEPC1|ATPEPC1|phosphoenolpyruvate carboxylase 1|PEP(PHOSPHOENOLPYRUVATE) CARBOXYLASE 1|F12M16.21|F12M16_21|AtPEPC1|phosphoethanolamine/phosphocholine phosphatase 1|Arabidopsis thaliana phosphoethanolamine/phosphocholine phosphatase 1|F11A6.5|F11A6_5|AT1G53310.1|AT1G53310.2|AT1G53310.3,No visible phenotype.,GO:0052731|GO:0052732|GO:0005829|GO:0051262|GO:0005515|GO:0016036|GO:0048046|PO:0000013|PO:0000014|PO:0009001|PO:0009005|PO:0009046|PO:0009047|PO:0000037|PO:0000230|PO:0008019|PO:0009006|PO:0009009|PO:0009010|PO:0009025|PO:0009029|PO:0009030|PO:0009031|PO:0009032|PO:0009052|PO:0020030|PO:0020038|PO:0020100|PO:0020137|PO:0025022|PO:0025281|PO:0000005|PO:0000084|PO:0025195|PO:0000293|PO:0025034|PO:0001054|PO:0001078|PO:0001081|PO:0001185|PO:0004507|PO:0007064|PO:0007095|PO:0007098|PO:0007103|PO:0007115|PO:0007123|PO:0007611|PO:0007616|PO:0001016|PO:0001017,AT1G53310,#DAF7A6
922,ath,At3g18290|EMB2454|AT3G18290|BTS|embryo defective 2454|BRUTUS|MIE15.8,Embryo defective-Preglobular / Globular. embryo defective; developmental arrest of mutant embryos.,GO:0010106|PO:0000013|PO:0000037|PO:0000230|PO:0008019|PO:0009005|PO:0009006|PO:0009009|PO:0009010|PO:0009025|PO:0009029|PO:0009030|PO:0009031|PO:0009032|PO:0009046|PO:0009047|PO:0009052|PO:0020030|PO:0020038|PO:0020100|PO:0020137|PO:0025022|PO:0025281|PO:0025195|PO:0000293|PO:0001054|PO:0001078|PO:0001081|PO:0001185|PO:0004507|PO:0007064|PO:0007095|PO:0007098|PO:0007103|PO:0007115|PO:0007123|PO:0007611|PO:0007616|PO:0001017,At3g18290,#DAF7A6
7551,ath,TNI,"Leaves are larger, rounder and curve upward compared to wild type. Leaf lamina are cup shaped. Increased branding of trichomes.",,TNI,#DAF7A6
5486,ath,AT5G15600|SP1L4|SPIRAL1-like4|T20K14.210|T20K14_210,Phenotype not described.,GO:0003674|GO:0008150|PO:0000013|PO:0000037|PO:0000230|PO:0008019|PO:0009005|PO:0009006|PO:0009009|PO:0009010|PO:0009025|PO:0009029|PO:0009030|PO:0009031|PO:0009032|PO:0009046|PO:0009052|PO:0020030|PO:0020038|PO:0020100|PO:0020137|PO:0025022|PO:0025281|PO:0000014|PO:0009047|PO:0025195|PO:0000293|PO:0001054|PO:0001078|PO:0001081|PO:0001185|PO:0004507|PO:0007095|PO:0007103|PO:0007115|PO:0007611|PO:0007616|PO:0007131|PO:0001016|PO:0001017,AT5G15600,#DAF7A6
7030,ath,EMB2527,embryo defective; terminal embryo phenotype: preglobular stage.,GO:0005575|GO:0008150|GO:0003674,EMB2527,#DAF7A6
4887,ath,AT3G23730|XTH16|xyloglucan endotransglucosylase/hydrolase 16|MYM9.11,No visible phenotype.,PO:0000013|PO:0000037|PO:0000230|PO:0008019|PO:0009005|PO:0009006|PO:0009009|PO:0009010|PO:0009025|PO:0009029|PO:0009030|PO:0009031|PO:0009032|PO:0009046|PO:0009047|PO:0009052|PO:0020030|PO:0020038|PO:0020100|PO:0020137|PO:0025022|PO:0025281|PO:0000293|PO:0001054|PO:0001078|PO:0001081|PO:0001185|PO:0004507|PO:0007064|PO:0007095|PO:0007098|PO:0007103|PO:0007115|PO:0007123|PO:0007611|PO:0007616,AT3G23730,#DAF7A6
5339,ath,AT4G35170|CC4|companion of cellulose synthase 4|T12J5.40|T12J5_40,Hypocotyls of etiolated mutants displayed cell swelling and elongation defects when grown on  salt containing media.,GO:0003674|GO:0008150|PO:0009030|PO:0009047|PO:0000191|PO:0007611,AT4G35170,#DAF7A6
374,ath,At5g40330|MYB23|AT5G40330|ATMYB23|ATMYBRTF|myb domain protein 23|MPO12.40|MPO12_40,"Decreased trichome branching. appear to have a normal root hair density, but a quantitative analysis shows they have a small but statistically significant increase in hair cell production in the N position. Excessive root hair production. GFP is expressed in all stages of differentiating root epidermal cells, in both hair (H) and non-hair (N) cell types, although preferentially in the N cells. In addition to having a reduced number of trichome branches, myb23 mutants have smaller trichomes. Patterning of trichomes is not affected.  However, there is reduced trichome branching with respect to the wild type, Columbia. Patterning of trichomes is not affected.  However, there is reduced trichome branching compared to the wild type, Wassilewskija. Trichomes are extremely reduced in size and have fewer branches. Also, fewer trichomes form along the margins of leaves.",GO:0005634|GO:0048629|GO:0010026|GO:0005515|GO:0010053|GO:0010091|PO:0006504|PO:0009005|PO:0009010|PO:0009025|PO:0009046|PO:0009047|PO:0000013|PO:0000037|PO:0009006|PO:0020038|PO:0025022|PO:0000263|PO:0000293|PO:0001054|PO:0007064|PO:0007115,At5g40330,#DAF7A6
7307,ath,GLD1,requires high CO2 to prevent flux of metabolites into the photorespiratory pathway.,GO:0019464|GO:0004375,GLD1,#DAF7A6
1864,ath,At2g36120|DOT1|AT2G36120|DEFECTIVELY ORGANIZED TRIBUTARIES 1|F9C22.5|F9C22_5,"Abnormal venation. Fused leaves. Rough leaves. dot1-1 mutants display an open-class leaf and cotyledon venation patterning defect with low penetrance. Post-genital fusions of aerial organs also occur in dot1-1 mutants, and they produce cup-shaped leaves with a reduced number of trichomes. Normal epidermal cell wall formation is disrupted at the site of the organ fusions. These mutants have reduced water permeability compared to wild type plants, but they have normal levels of fertility and normal patterns of root and stem development.",GO:0048366|GO:0010305|GO:0010087|GO:0010588|PO:0000013|PO:0000230|PO:0009005|PO:0009025|PO:0009046|PO:0020100|PO:0020137|PO:0025022|PO:0000017|PO:0000293|PO:0007103|PO:0007115|PO:0007123|PO:0007611,At2g36120,#DAF7A6
6738,ath,EMB210,"developmental arrest of mutant embryos occurs at globular-linear stage, monocotyledonous; pale yellow-green seeds; white to pale green embryo; 23.8% mutant; 52.9% aborted seeds in top half of silique.",GO:0005575|GO:0003674,EMB210,#DAF7A6
4957,ath,AT3G48780|SPT1|ATSPT1|SERINE PALMITOYLTRANSFERASE 1|T21J18.50,"Double mutant is male gametophytic lethal due to defects in pollen development. Phenotype of the double mutant pollens became apparent in the bicellular stage. The cytoplasm was less dense and plastids were dilated and lacked oil droplets. The nuclear envelope structure was modified by the formation of vesicles between the inner and outer membranes. The microspores lacked the intine layer, and consequently lacked clearly defined ER and Golgi.",GO:0004758|GO:0009640|GO:0030148|GO:0009555|PO:0000293,AT3G48780,#DAF7A6
1373,ath,At3g53130|LUT1|AT3G53130|CYP97C1|LUTEIN DEFICIENT 1|CYTOCHROME P450 97C1|T4D2.60,"Low lutein levels. Marked reductions in Tg accumulation in inflorescence tissues, increased  levels of NA, glucosylated NA (NAOG and NANG), NaMN, and NAD . In leaves, 25% increase in zeinoxanthin levels; 25% and 35% reduction in violaxanthin and lutein, respectively; %beta;-Carotene increased by 35%; all in relation to single mutant lut1-2. In seeds, similar amounts of carotenoids relative to lut1 b2. Intermediate compared to Col and Ws parents. Higher levels of lutein compared to lut1 b2. Level of total carotenoid  not significantly different from wild-type. No visible phenotype. In leaves, the only carotenoids significantly changed in the double mutant were &#946;-carotene and lutein. In seeds, similar amounts of carotenoids relative to lut1 b1. Intermediate compared to Col and Ws parents. Greater levels of individual and total &#946;-carotene-derived xanthophylls compared to lut1 b1. Accumulation of intermediate zeinoxanthin and contains 8% of wild type lutein. Leaky mutation. Double mutants were indistinguishable from bps1 single mutants. In leaves, 80% decrease in lutein content, accumulation of   monohydroxy xanthophyll &#946;-cryptoxanthin, and twofold larger xanthophyll cycle carotenoid pool (violaxanthin + antheraxanthin + zeaxanthine).  &#946;-Carotene and neoxanthin content remains largely unchanged. In seeds, lutein content reduced by 30%. No zeinoxanthin accumulation. 20% less total carotenoids on a fresh weight basis compared to wildtype. Chlorophyll a/b ratio is significantly higher than that of other genotypes. In leaves: dramatic alteration in carotenoid composition: more than twice the levels of &#946;-carotene compared to wildtype. Reduction of 95% and 60% for neoxanthin and violaxanthin compared to wildtype. Zeaxanthin and antheraxanthin totally absent.  &#946;-Carotene-derived xanthophylls (violaxanthin + zeaxanthin + antheraxanthin + neoxanthin) only account for 5% of total carotenoids compared to 25 to 30% in wildtype. Lutein content is unchanged in the triple mutant compared to lut1 b1 and lut1 b2 double mutants, but zeinoxanthin has more than doubled compared to any of the lut1 genotypes. In seeds, total carotenoid levels 35% lower than that of lut1 b1 and lut1 b2 but lutein still accounts for 80% of total carotenoids. Most &#946;-carotene-derived xanthophylls are significantly reduced compared to aforementioned double-mutants. 4- to 20-fold increase in &#946;-carotene relative to other genotypes. Smaller and paler than either parental wild-type ecotypes (Col and Ws). Very rapid initial induction of non-photochemical quenching (NPQ) but NPQ level was greatly reduced compared to wildtype levels and all other genotypes. Accumulated zeinoxanthin but, unlike lut1-1 and lut1-2, lacks lutein. Completely lacks lutein. Significant reduction of hydroxylated &beta;-rings xanthophylls. Virtually lacks lutein and accumulates high levels of zeinoxanthin (&#946;,&#949;-carotene with a hydroxylated &#946;-ring) and elevated levels of zeaxanthin, antheraxanthin, violaxanthin and neoxanthin (&#946;,&#946;-xanthophylls). Accumulates &#945;-carotene and zeinoxanthin at levels nearly identical to lut5-1 and lut1-4 single mutants, respectively.",GO:0016117|GO:0009941|GO:0009974|GO:0009507|PO:0000013|PO:0000037|PO:0000230|PO:0008019|PO:0009006|PO:0009009|PO:0009010|PO:0009025|PO:0009029|PO:0009030|PO:0009031|PO:0009032|PO:0009046|PO:0009047|PO:0009052|PO:0020030|PO:0020038|PO:0020100|PO:0020137|PO:0025022|PO:0025281|PO:0000293|PO:0001054|PO:0001078|PO:0001081|PO:0001185|PO:0004507|PO:0007064|PO:0007095|PO:0007098|PO:0007103|PO:0007115|PO:0007123|PO:0007611|PO:0007616,At3g53130,#DAF7A6
4054,ath,AT1G20500,No visible phenotype.,,AT1G20500,#DAF7A6
5982,ath,EMB1118,embryo defective; terminal embryo phenotype: zygotic/preglobular stage.,GO:0003674|GO:0005575|GO:0008150,EMB1118,#DAF7A6
890,ath,At3g17300|EMB2786|AT3G17300|MGD8.14,Embryo defective-Preglobular.,PO:0000013|PO:0000037|PO:0000230|PO:0008019|PO:0009005|PO:0009006|PO:0009009|PO:0009010|PO:0009025|PO:0009029|PO:0009030|PO:0009031|PO:0009032|PO:0009046|PO:0009047|PO:0009052|PO:0020030|PO:0020038|PO:0020100|PO:0020137|PO:0025022|PO:0025281|PO:0000293|PO:0001054|PO:0001078|PO:0001081|PO:0001185|PO:0004507|PO:0007064|PO:0007095|PO:0007098|PO:0007103|PO:0007115|PO:0007123|PO:0007611|PO:0007616,At3g17300,#DAF7A6
